{
  "schema_version": "v1",
  "generated_from": "public/gamehub/content/curriculum-source",
  "phase_gap_policy": {
    "missing_phases_allowed": [
      "Phase 10"
    ],
    "notes": "Phase 10 is intentionally absent from curriculum-source and is explicitly allowed in this index."
  },
  "entries": [
    {
      "phase_id": "phase-11",
      "phase_folder": "Phase 11",
      "source_file": "Grade 3 Math Production Addition + Subtraction Skill 4 Multi-Digit Addition + Subtraction",
      "inferred_grade": "Grade 3",
      "inferred_subject": "Math",
      "inferred_content_type": "production-skill-content",
      "conversion_status": "indexed_only",
      "needs_review": true,
      "notes": "Auto-inferred from source file name; review before conversion."
    },
    {
      "phase_id": "phase-11",
      "phase_folder": "Phase 11",
      "source_file": "Grade 3 Math Production Division Foundations Skill 8 Division as Equal Sharing",
      "inferred_grade": "Grade 3",
      "inferred_subject": "Math",
      "inferred_content_type": "production-skill-content",
      "conversion_status": "indexed_only",
      "needs_review": true,
      "notes": "Auto-inferred from source file name; review before conversion."
    },
    {
      "phase_id": "phase-11",
      "phase_folder": "Phase 11",
      "source_file": "Grade 3 Math Production Fractions Foundations Skill 9 Fractions as Equal Parts",
      "inferred_grade": "Grade 3",
      "inferred_subject": "Math",
      "inferred_content_type": "production-skill-content",
      "conversion_status": "indexed_only",
      "needs_review": true,
      "notes": "Auto-inferred from source file name; review before conversion."
    },
    {
      "phase_id": "phase-11",
      "phase_folder": "Phase 11",
      "source_file": "Grade 3 Math Production Multiplication Foundations Skill 5 Multiplication as Equal Groups",
      "inferred_grade": "Grade 3",
      "inferred_subject": "Math",
      "inferred_content_type": "production-skill-content",
      "conversion_status": "indexed_only",
      "needs_review": true,
      "notes": "Auto-inferred from source file name; review before conversion."
    },
    {
      "phase_id": "phase-11",
      "phase_folder": "Phase 11",
      "source_file": "Grade 3 Math Production Multiplication Foundations Skill 6 Arrays + Multiplication Models",
      "inferred_grade": "Grade 3",
      "inferred_subject": "Math",
      "inferred_content_type": "production-skill-content",
      "conversion_status": "indexed_only",
      "needs_review": true,
      "notes": "Auto-inferred from source file name; review before conversion."
    },
    {
      "phase_id": "phase-11",
      "phase_folder": "Phase 11",
      "source_file": "Grade 3 Math Production Multiplication Foundations Skill 7 Multiplication Facts + Fluency",
      "inferred_grade": "Grade 3",
      "inferred_subject": "Math",
      "inferred_content_type": "production-skill-content",
      "conversion_status": "indexed_only",
      "needs_review": true,
      "notes": "Auto-inferred from source file name; review before conversion."
    },
    {
      "phase_id": "phase-11",
      "phase_folder": "Phase 11",
      "source_file": "Grade 3 Math Production Number Sense + Place Value Skill 1 Place Value Through Thousands",
      "inferred_grade": "Grade 3",
      "inferred_subject": "Math",
      "inferred_content_type": "production-skill-content",
      "conversion_status": "indexed_only",
      "needs_review": true,
      "notes": "Auto-inferred from source file name; review before conversion."
    },
    {
      "phase_id": "phase-11",
      "phase_folder": "Phase 11",
      "source_file": "Grade 3 Math Production Number Sense + Place Value Skill 2 Comparing + Ordering Numbers",
      "inferred_grade": "Grade 3",
      "inferred_subject": "Math",
      "inferred_content_type": "production-skill-content",
      "conversion_status": "indexed_only",
      "needs_review": true,
      "notes": "Auto-inferred from source file name; review before conversion."
    },
    {
      "phase_id": "phase-11",
      "phase_folder": "Phase 11",
      "source_file": "Grade 3 Math Production Number Sense + Place Value Skill 3 Rounding to Nearest 10 and 100",
      "inferred_grade": "Grade 3",
      "inferred_subject": "Math",
      "inferred_content_type": "production-skill-content",
      "conversion_status": "indexed_only",
      "needs_review": true,
      "notes": "Auto-inferred from source file name; review before conversion."
    },
    {
      "phase_id": "phase-11",
      "phase_folder": "Phase 11",
      "source_file": "Grade 3 Math Production Problem Solving + Measurement Skill 10 Multi-Step Word Problems",
      "inferred_grade": "Grade 3",
      "inferred_subject": "Math",
      "inferred_content_type": "production-skill-content",
      "conversion_status": "indexed_only",
      "needs_review": true,
      "notes": "Auto-inferred from source file name; review before conversion."
    },
    {
      "phase_id": "phase-12",
      "phase_folder": "Phase 12",
      "source_file": "Grade 3 Reading  English Production Reading Comprehension Skill 2 Sequence + Story Events",
      "inferred_grade": "Grade 3",
      "inferred_subject": "Reading/English",
      "inferred_content_type": "production-skill-content",
      "conversion_status": "indexed_only",
      "needs_review": true,
      "notes": "Auto-inferred from source file name; review before conversion."
    },
    {
      "phase_id": "phase-12",
      "phase_folder": "Phase 12",
      "source_file": "Grade 3 Reading  English Production Reading Comprehension Skill 3 Cause + Effect",
      "inferred_grade": "Grade 3",
      "inferred_subject": "Reading/English",
      "inferred_content_type": "production-skill-content",
      "conversion_status": "indexed_only",
      "needs_review": true,
      "notes": "Auto-inferred from source file name; review before conversion."
    },
    {
      "phase_id": "phase-12",
      "phase_folder": "Phase 12",
      "source_file": "Grade 3 Reading  English Production Reading Foundations Skill 1 Main Idea + Key Details",
      "inferred_grade": "Grade 3",
      "inferred_subject": "Reading/English",
      "inferred_content_type": "production-skill-content",
      "conversion_status": "indexed_only",
      "needs_review": true,
      "notes": "Auto-inferred from source file name; review before conversion."
    },
    {
      "phase_id": "phase-12",
      "phase_folder": "Phase 12",
      "source_file": "Grade 3 Reading English Production Literature + Response Skill 7 Character Traits + Feelings",
      "inferred_grade": "Grade 3",
      "inferred_subject": "Reading/English",
      "inferred_content_type": "production-skill-content",
      "conversion_status": "indexed_only",
      "needs_review": true,
      "notes": "Auto-inferred from source file name; review before conversion."
    },
    {
      "phase_id": "phase-12",
      "phase_folder": "Phase 12",
      "source_file": "Grade 3 Reading English Production Reading Comprehension Skill 4 Compare + Contrast",
      "inferred_grade": "Grade 3",
      "inferred_subject": "Reading/English",
      "inferred_content_type": "production-skill-content",
      "conversion_status": "indexed_only",
      "needs_review": true,
      "notes": "Auto-inferred from source file name; review before conversion."
    },
    {
      "phase_id": "phase-12",
      "phase_folder": "Phase 12",
      "source_file": "Grade 3 Reading English Production Vocabulary + Language Skill 5 Context Clues",
      "inferred_grade": "Grade 3",
      "inferred_subject": "Reading/English",
      "inferred_content_type": "production-skill-content",
      "conversion_status": "indexed_only",
      "needs_review": true,
      "notes": "Auto-inferred from source file name; review before conversion."
    },
    {
      "phase_id": "phase-12",
      "phase_folder": "Phase 12",
      "source_file": "Grade 3 Reading English Production Vocabulary + Language Skill 6 Prefixes + Suffixes",
      "inferred_grade": "Grade 3",
      "inferred_subject": "Reading/English",
      "inferred_content_type": "production-skill-content",
      "conversion_status": "indexed_only",
      "needs_review": true,
      "notes": "Auto-inferred from source file name; review before conversion."
    },
    {
      "phase_id": "phase-12",
      "phase_folder": "Phase 12",
      "source_file": "Grade 3 Reading English Production Writing + Language Skill 10 Editing + Revising",
      "inferred_grade": "Grade 3",
      "inferred_subject": "Reading/English",
      "inferred_content_type": "production-skill-content",
      "conversion_status": "indexed_only",
      "needs_review": true,
      "notes": "Auto-inferred from source file name; review before conversion."
    },
    {
      "phase_id": "phase-12",
      "phase_folder": "Phase 12",
      "source_file": "Grade 3 Reading English Production Writing + Language Skill 8 Sentence Types + Structure",
      "inferred_grade": "Grade 3",
      "inferred_subject": "Reading/English",
      "inferred_content_type": "production-skill-content",
      "conversion_status": "indexed_only",
      "needs_review": true,
      "notes": "Auto-inferred from source file name; review before conversion."
    },
    {
      "phase_id": "phase-12",
      "phase_folder": "Phase 12",
      "source_file": "Grade 3 Reading English Production Writing + Language Skill 9 Paragraph Organization",
      "inferred_grade": "Grade 3",
      "inferred_subject": "Reading/English",
      "inferred_content_type": "production-skill-content",
      "conversion_status": "indexed_only",
      "needs_review": true,
      "notes": "Auto-inferred from source file name; review before conversion."
    },
    {
      "phase_id": "phase-13",
      "phase_folder": "Phase 13",
      "source_file": "Grade 4 Math Production Fractions Skill 7 Fraction Equivalence + Comparison",
      "inferred_grade": "Grade 4",
      "inferred_subject": "Math",